{
  "$schema": "http://json-schema.org/draft-07/schema#",
  "title": "Pack",
  "description": "Schema for bird species pack definition",
  "type": "object",
  "required": [
    "pack_id",
    "display_name",
    "description",
    "species",
    "vocalization_weights"
  ],
  "properties": {
    "pack_id": {
      "type": "string",
      "pattern": "^[a-z_]+$",
      "description": "Unique identifier for the pack (lowercase with underscores)"
    },
    "display_name": {
      "type": "string",
      "minLength": 1,
      "description": "Display name for the pack"
    },
    "description": {
      "type": "string",
      "description": "Description of the pack"
    },
    "region": {
      "type": "string",
      "enum": ["na", "nz", "eu"],
      "description": "Region identifier: 'na' for North America (default), 'nz' for New Zealand, 'eu' for Europe"
    },
    "species": {
      "type": "array",
      "items": {
        "type": "string",
        "pattern": "^[A-Za-z0-9]{3,10}$"
      },
      "minItems": 1,
      "uniqueItems": true,
      "description": "Array of species codes (4-letter NA codes or eBird codes for NZ)"
    },
    "display_species": {
      "type": "array",
      "items": {
        "type": "string",
        "pattern": "^[A-Za-z0-9]{3,10}$"
      },
      "minItems": 1,
      "uniqueItems": true,
      "description": "Optional array of species codes for bird reference display (can be larger than gameplay species)"
    },
    "vocalization_weights": {
      "type": "object",
      "required": ["song", "call"],
      "properties": {
        "song": {
          "type": "number",
          "minimum": 0,
          "maximum": 1,
          "description": "Weight for songs (0-1)"
        },
        "call": {
          "type": "number",
          "minimum": 0,
          "maximum": 1,
          "description": "Weight for calls (0-1)"
        }
      },
      "additionalProperties": false,
      "description": "Vocalization type weights"
    },
    "overlap_multiplier": {
      "type": "number",
      "minimum": 0.5,
      "maximum": 2.0,
      "default": 1.0,
      "description": "Multiplier for overlap probability (0.5-2.0)"
    },
    "tempo_multiplier": {
      "type": "number",
      "minimum": 0.5,
      "maximum": 2.0,
      "default": 1.0,
      "description": "Multiplier for event tempo (0.5-2.0)"
    },
    "seasonal_context": {
      "type": ["string", "null"],
      "description": "Optional seasonal context (e.g., 'spring', 'winter')"
    },
    "region_filter": {
      "type": "string",
      "description": "Optional region filter for subspecies selection (e.g., 'north_island', 'south_island')"
    },
    "subspecies_filter": {
      "type": "object",
      "description": "Optional mapping of species codes to subspecies filters",
      "additionalProperties": {
        "type": "string"
      }
    }
  },
  "additionalProperties": false
}
