{
  "pack_id": "nz_south_island",
  "region": "nz",
  "region_filter": "SI",
  "display_name": "South Island",
  "description": "Birds of Te Waipounamu. For merged subspecies like Toutouwai, only South Island recordings are used.",
  "species": [
    "tui1",
    "nezbel1",
    "nezfan1",
    "gryger1",
    "nezpig2",
    "morepo2",
    "silver3",
    "parshe1",
    "nezkak1",
    "nezfal1",
    "nezrob3",
    "tomtit1",
    "refpar4",
    "weka1",
    "kea1",
    "yellow3",
    "soiwre1",
    "takahe3",
    "malpar2",
    "bluduc1",
    "blasti1",
    "yeepen1"
  ],
  "display_species": [
    "tui1",
    "nezbel1",
    "nezfan1",
    "gryger1",
    "nezpig2",
    "morepo2",
    "silver3",
    "parshe1",
    "nezkak1",
    "nezfal1",
    "nezrob3",
    "tomtit1",
    "refpar4",
    "weka1",
    "kea1",
    "yellow3",
    "soiwre1",
    "takahe3",
    "malpar2",
    "bluduc1",
    "blasti1",
    "yeepen1"
  ],
  "subspecies_filter": {
    "nezrob3": "nezrob3",
    "tomtit1": "tomtit1",
    "saddle3": "saddle3",
    "tui1": "tui1",
    "nezfan1": "nezfan1"
  },
  "vocalization_weights": {
    "song": 0.5,
    "call": 0.5
  },
  "overlap_multiplier": 1.0,
  "tempo_multiplier": 1.0
}
