{
  "pack_id": "woodpeckers",
  "display_name": "Woodpeckers",
  "description": "Percussive, rhythmic species. Features drums and calls with exaggerated stereo panning.",
  "species": [
    "RBWO",
    "DOWO",
    "HAWO",
    "PIWO",
    "NOFL",
    "RHWO",
    "YBSA",
    "ACWO",
    "LEWO"
  ],
  "vocalization_weights": {
    "song": 0.3,
    "call": 0.7
  },
  "overlap_multiplier": 0.8,
  "tempo_multiplier": 1.0,
  "seasonal_context": null
}
