{
  "pack_id": "nz_north_island",
  "region": "nz",
  "region_filter": "NI",
  "display_name": "North Island",
  "description": "Birds of Te Ika-a-Maui. For merged subspecies like Toutouwai, only North Island recordings are used.",
  "species": [
    "tui1",
    "nezbel1",
    "nezfan1",
    "gryger1",
    "nezpig2",
    "morepo2",
    "silver3",
    "parshe1",
    "nezkak1",
    "nezfal1",
    "nezrob2",
    "tomtit1",
    "refpar4",
    "weka1",
    "nibkiw1",
    "kokako3",
    "whiteh1",
    "stitch1",
    "ausbit1",
    "rebdot1",
    "greegr"
  ],
  "display_species": [
    "tui1",
    "nezbel1",
    "nezfan1",
    "gryger1",
    "nezpig2",
    "morepo2",
    "silver3",
    "parshe1",
    "nezkak1",
    "nezfal1",
    "nezrob2",
    "tomtit1",
    "refpar4",
    "weka1",
    "nibkiw1",
    "kokako3",
    "whiteh1",
    "stitch1",
    "ausbit1",
    "rebdot1",
    "greegr"
  ],
  "subspecies_filter": {
    "nezrob2": "nezrob2",
    "tomtit1": "tomtit1",
    "saddle2": "saddle2",
    "tui1": "tui1",
    "nezfan1": "nezfan1"
  },
  "vocalization_weights": {
    "song": 0.5,
    "call": 0.5
  },
  "overlap_multiplier": 1.0,
  "tempo_multiplier": 1.0
}
