{
  "pack_id": "expanded_backyard",
  "display_name": "Eastern Birds",
  "description": "60 species commonly found in backyards across eastern North America. Includes woodpeckers, songbirds, flycatchers, vireos, raptors, and more.",
  "species": [
    "NOCA",
    "CARW",
    "BLJA",
    "AMCR",
    "TUTI",
    "BEKI",
    "RSHA",
    "AGOL",
    "CACH",
    "PIWA",
    "WTSP",
    "HOFI",
    "EABL",
    "AMRO",
    "HETH",
    "BHNU",
    "BRCR",
    "WBNU",
    "YBSA",
    "RBWO",
    "DOWO",
    "HAWO",
    "NOFL",
    "PIWO",
    "BRTH",
    "GRCA",
    "MODO",
    "NOMO",
    "GCKI",
    "RCKI",
    "COHA",
    "SSHA",
    "RTHA",
    "RTHU",
    "BAOW",
    "COGR",
    "FICR",
    "CEDW",
    "DEJU",
    "EATO",
    "WEVI",
    "ACFL",
    "EAPH",
    "GCFL",
    "EAWP",
    "REVI",
    "WOTH",
    "KILL",
    "BAOR",
    "NHWR",
    "EUST",
    "YBCU",
    "CHSW",
    "SCTA",
    "VEER",
    "SUTA",
    "BGGN",
    "GBHE",
    "GRHE",
    "RBNU"
  ],
  "display_species": [
    "NOCA",
    "CARW",
    "BLJA",
    "AMCR",
    "TUTI",
    "BEKI",
    "RSHA",
    "AGOL",
    "CACH",
    "PIWA",
    "WTSP",
    "HOFI",
    "EABL",
    "AMRO",
    "HETH",
    "BHNU",
    "BRCR",
    "WBNU",
    "YBSA",
    "RBWO",
    "DOWO",
    "HAWO",
    "NOFL",
    "PIWO",
    "BRTH",
    "GRCA",
    "MODO",
    "NOMO",
    "GCKI",
    "RCKI",
    "COHA",
    "SSHA",
    "RTHA",
    "RTHU",
    "BAOW",
    "COGR",
    "FICR",
    "CEDW",
    "DEJU",
    "EATO",
    "WEVI",
    "ACFL",
    "EAPH",
    "GCFL",
    "EAWP",
    "REVI",
    "WOTH",
    "KILL",
    "BAOR",
    "NHWR",
    "EUST",
    "YBCU",
    "CHSW",
    "SCTA",
    "VEER",
    "SUTA",
    "BGGN",
    "GBHE",
    "GRHE",
    "RBNU"
  ],
  "vocalization_weights": {
    "song": 0.6,
    "call": 0.4
  },
  "overlap_multiplier": 1.0,
  "tempo_multiplier": 1.0,
  "seasonal_context": null,
  "region": "na"
}