{
  "pack_id": "nz_backyard",
  "display_name": "NZ Backyard Birds",
  "description": "10 common birds you might hear in a New Zealand garden. Perfect for beginners learning NZ bird songs.",
  "species": [
    "TUIX",
    "BELL",
    "NIFA",
    "GRWA",
    "SILV",
    "KERE",
    "MORU",
    "NITO",
    "PADU",
    "WHIT"
  ],
  "vocalization_weights": {
    "song": 0.6,
    "call": 0.4
  },
  "overlap_multiplier": 1.0,
  "tempo_multiplier": 1.0,
  "seasonal_context": null
}
