{
  "pack_id": "common_se_birds",
  "display_name": "Common SE Birds",
  "description": "Ultra-common birds of the southeastern United States. Baseline difficulty pack featuring distinctive, easily recognizable species.",
  "species": [
    "NOCA",
    "BLJA",
    "CARW",
    "AMCR",
    "TUTI",
    "EABL",
    "MODO",
    "AMRO",
    "RBWO",
    "DOWO",
    "HAWO",
    "PIWO",
    "YSFL",
    "BCCH",
    "WBNU",
    "BGGN",
    "CACH",
    "EATO",
    "CHSP",
    "SOSP",
    "FISP",
    "WTSP",
    "SAVS",
    "NOMO",
    "BHCO",
    "COGR",
    "RWBL",
    "EAME",
    "HOFI",
    "AMGO",
    "HOSP"
  ],
  "vocalization_weights": {
    "song": 0.6,
    "call": 0.4
  },
  "overlap_multiplier": 1.0,
  "tempo_multiplier": 1.0,
  "seasonal_context": null
}
