{
  "pack_id": "eu_warblers",
  "region": "eu",
  "display_name": "Warblers & Skulkers",
  "description": "35 species of European warblers, skulkers, and secretive songbirds. From Nightingales to Treecreepers — birds that MUST be identified by ear.",
  "species": [
    "SEWA",
    "RIWA",
    "CCHI",
    "WILW",
    "WOWA",
    "EUBC",
    "LEWH",
    "ICWA",
    "BLUE",
    "SPFL",
    "EUSK",
    "EURO",
    "CCRA",
    "eurwar1",
    "marwar3",
    "grrwar1",
    "cogwar1",
    "savwar1",
    "webwar1",
    "garwar1",
    "grewhi1",
    "barwar1",
    "darwar1",
    "comnig1",
    "thrnig1",
    "cetwar1",
    "eupfly1",
    "colfly1",
    "eurtre1",
    "shttre1",
    "goldcr1",
    "firecr1",
    "woolar1",
    "dunnoc1",
    "winwre4"
  ],
  "display_species": [
    "SEWA",
    "RIWA",
    "CCHI",
    "WILW",
    "WOWA",
    "EUBC",
    "LEWH",
    "ICWA",
    "BLUE",
    "SPFL",
    "EUSK",
    "EURO",
    "CCRA",
    "eurwar1",
    "marwar3",
    "grrwar1",
    "cogwar1",
    "savwar1",
    "webwar1",
    "garwar1",
    "grewhi1",
    "barwar1",
    "darwar1",
    "comnig1",
    "thrnig1",
    "cetwar1",
    "eupfly1",
    "colfly1",
    "eurtre1",
    "shttre1",
    "goldcr1",
    "firecr1",
    "woolar1",
    "dunnoc1",
    "winwre4"
  ],
  "vocalization_weights": {
    "song": 0.7,
    "call": 0.3
  },
  "overlap_multiplier": 1.0,
  "tempo_multiplier": 1.0,
  "seasonal_context": "spring"
}
