{
  "pack_id": "nz_common",
  "region": "nz",
  "display_name": "Garden & Bush",
  "description": "The 9 most common birds you'll hear in gardens, parks, and forests across New Zealand.",
  "species": [
    "tui1",
    "nezbel1",
    "nezfan1",
    "gryger1",
    "nezpig2",
    "silver3",
    "morepo2",
    "parshe1",
    "weka1"
  ],
  "display_species": [
    "tui1",
    "nezbel1",
    "nezfan1",
    "gryger1",
    "nezpig2",
    "silver3",
    "morepo2",
    "parshe1",
    "weka1"
  ],
  "vocalization_weights": {
    "song": 0.6,
    "call": 0.4
  },
  "overlap_multiplier": 1.0,
  "tempo_multiplier": 1.0
}
