{
  "pack_id": "nz_chatham_islands",
  "region": "nz",
  "display_name": "Chatham Islands",
  "description": "Endemic subspecies from the remote Chatham Islands, 800km east of mainland New Zealand. These birds have evolved distinct songs in isolation.",
  "species": [
    "chafan1",
    "chatom1",
    "chatui1",
    "nezpig3",
    "chaoys1"
  ],
  "vocalization_weights": {
    "song": 0.5,
    "call": 0.5
  },
  "overlap_multiplier": 1.0,
  "tempo_multiplier": 1.0
}
