{
  "pack_id": "nz_iconic",
  "region": "nz",
  "display_name": "Iconic Endemics",
  "description": "New Zealand's most famous native birds - conservation stars found nowhere else on Earth. Includes Kiwi, Kea, Kākāpō, and more.",
  "species": [
    "nibkiw1",
    "kea1",
    "kakapo2",
    "kokako3",
    "takahe3",
    "stitch1",
    "saddle2",
    "saddle3",
    "nezrob2",
    "nezrob3"
  ],
  "vocalization_weights": {
    "song": 0.5,
    "call": 0.5
  },
  "overlap_multiplier": 1.0,
  "tempo_multiplier": 1.0
}
