{
  "pack_id": "grassland_birds",
  "display_name": "Grassland & Open Country",
  "description": "Ten species of open habitats including grasslands, prairies, farmland, and field edges. Features distinctive singers like Eastern Meadowlark, Dickcissel, Red-winged Blackbird, and Yellow Warbler.",
  "species": [
    "INBU",
    "EAKI",
    "BARS",
    "EAME",
    "DICK",
    "RWBL",
    "SAVS",
    "FISP",
    "COYE",
    "YEWA"
  ],
  "display_species": [
    "INBU",
    "EAKI",
    "BARS",
    "EAME",
    "DICK",
    "RWBL",
    "SAVS",
    "FISP",
    "COYE",
    "YEWA"
  ],
  "vocalization_weights": {
    "song": 0.7,
    "call": 0.3
  },
  "overlap_multiplier": 1.0,
  "tempo_multiplier": 1.0,
  "seasonal_context": "summer",
  "region": "na"
}