{
  "pack_id": "starter_birds",
  "display_name": "Backyard Birds",
  "description": "Learn to identify 6 of the most common and distinctive birds in eastern North America. Perfect for beginners.",
  "species": [
    "NOCA",
    "CARW",
    "BLJA",
    "AMCR",
    "TUTI",
    "AMRO"
  ],
  "vocalization_weights": {
    "song": 0.7,
    "call": 0.3
  },
  "overlap_multiplier": 1.0,
  "tempo_multiplier": 1.0,
  "seasonal_context": null,
  "region": "na"
}