{
  "pack_id": "spring_warblers",
  "display_name": "Warbler Academy",
  "description": "34 wood-warblers \u2014 9 random per round. Use Custom Pack for focused warbler brain training!",
  "species": [
    "AMRE",
    "BAWW",
    "BBWA",
    "BLBW",
    "BLPW",
    "BTBW",
    "BTNW",
    "BWWA",
    "CAWA",
    "CMWA",
    "CONW",
    "COYE",
    "CSWA",
    "GWWA",
    "KEWA",
    "LOWA",
    "MAWA",
    "MOWA",
    "NAWA",
    "NOPA",
    "NOWA",
    "OCWA",
    "OVEN",
    "PAWA",
    "PIWA",
    "PRAW",
    "PROW",
    "SWWA",
    "TEWA",
    "WEWA",
    "WIWA",
    "YEWA",
    "YRWA",
    "YTWA"
  ],
  "vocalization_weights": {
    "song": 0.9,
    "call": 0.1
  },
  "overlap_multiplier": 1.2,
  "tempo_multiplier": 1.1,
  "seasonal_context": "spring",
  "region": "na"
}