{
  "pack_id": "sparrows",
  "display_name": "Sparrows",
  "description": "Short chips and subtle differences. Calls emphasized with tight timing requirements.",
  "species": [
    "SOSP",
    "CHSP",
    "FISP",
    "WTSP",
    "SAVS",
    "SWSP",
    "LISP",
    "WCSP",
    "HOSP"
  ],
  "vocalization_weights": {
    "song": 0.2,
    "call": 0.8
  },
  "overlap_multiplier": 1.0,
  "tempo_multiplier": 1.1,
  "seasonal_context": null,
  "region": "na"
}