{
  "pack_id": "nz_rare",
  "region": "nz",
  "display_name": "Rare & Endemic",
  "description": "Conservation stars and remote island specialists. Includes Kiwi, Kākāpō, Takahē, and the unique Chatham Islands subspecies.",
  "species": [
    "nibkiw1",
    "kakapo2",
    "kokako3",
    "takahe3",
    "stitch1",
    "saddle2",
    "saddle3",
    "soiwre1",
    "yeepen1",
    "bluduc1",
    "blasti1",
    "ausbit1",
    "rebdot1",
    "hutshe1",
    "wespet1",
    "auitea1",
    "chafan1",
    "chatom1",
    "chatui1",
    "nezpig3",
    "chaoys1"
  ],
  "vocalization_weights": {
    "song": 0.5,
    "call": 0.5
  },
  "overlap_multiplier": 1.0,
  "tempo_multiplier": 1.0
}
