{
  "pack_id": "eu_raptors",
  "region": "eu",
  "display_name": "Raptors",
  "description": "9 European raptors — hawks, kites, buzzards, and falcons. Learn the screams, mews, and calls of Europe's birds of prey.",
  "species": [
    "ESPA",
    "EGOS",
    "BLAK",
    "redkit1",
    "combuz1",
    "euhbuz1",
    "EUKE",
    "EUHO",
    "PEFA"
  ],
  "display_species": [
    "ESPA",
    "EGOS",
    "BLAK",
    "redkit1",
    "combuz1",
    "euhbuz1",
    "EUKE",
    "EUHO",
    "PEFA"
  ],
  "vocalization_weights": {
    "song": 0.0,
    "call": 1.0
  },
  "overlap_multiplier": 1.0,
  "tempo_multiplier": 1.0
}
