{
  "pack_id": "eu_woodland",
  "region": "eu",
  "display_name": "Woodland & Field",
  "description": "17 species of European thrushes, corvids, woodpeckers, and oriole. The bold, loud voices of woodland and open country.",
  "species": [
    "EUBB",
    "SOTH",
    "MITH",
    "FIEL",
    "REDW",
    "eugori2",
    "EUJA",
    "ROOK",
    "carcro1",
    "CORA",
    "eurmag1",
    "eurjay1",
    "eugwoo2",
    "blawoo1",
    "GSWO",
    "miswoo1",
    "leswoo1"
  ],
  "display_species": [
    "EUBB",
    "SOTH",
    "MITH",
    "FIEL",
    "REDW",
    "eugori2",
    "EUJA",
    "ROOK",
    "carcro1",
    "CORA",
    "eurmag1",
    "eurjay1",
    "eugwoo2",
    "blawoo1",
    "GSWO",
    "miswoo1",
    "leswoo1"
  ],
  "vocalization_weights": {
    "song": 0.5,
    "call": 0.5
  },
  "overlap_multiplier": 1.0,
  "tempo_multiplier": 1.0
}
