{
  "pack_id": "eu_all_birds",
  "region": "eu",
  "display_name": "All European Birds",
  "description": "The complete collection of 61 European bird species across all EU packs — warblers, raptors, thrushes, corvids, woodpeckers, and more.",
  "species": [
    "SEWA",
    "RIWA",
    "CCHI",
    "WILW",
    "WOWA",
    "EUBC",
    "LEWH",
    "ICWA",
    "BLUE",
    "SPFL",
    "EUSK",
    "EURO",
    "CCRA",
    "eurwar1",
    "marwar3",
    "grrwar1",
    "cogwar1",
    "savwar1",
    "webwar1",
    "garwar1",
    "grewhi1",
    "barwar1",
    "darwar1",
    "comnig1",
    "thrnig1",
    "cetwar1",
    "eupfly1",
    "colfly1",
    "eurtre1",
    "shttre1",
    "goldcr1",
    "firecr1",
    "woolar1",
    "dunnoc1",
    "winwre4",
    "ESPA",
    "EGOS",
    "BLAK",
    "redkit1",
    "combuz1",
    "euhbuz1",
    "EUKE",
    "EUHO",
    "PEFA",
    "EUBB",
    "SOTH",
    "MITH",
    "FIEL",
    "REDW",
    "eugori2",
    "EUJA",
    "ROOK",
    "carcro1",
    "CORA",
    "eurmag1",
    "eurjay1",
    "eugwoo2",
    "blawoo1",
    "GSWO",
    "miswoo1",
    "leswoo1"
  ],
  "display_species": [
    "SEWA",
    "RIWA",
    "CCHI",
    "WILW",
    "WOWA",
    "EUBC",
    "LEWH",
    "ICWA",
    "BLUE",
    "SPFL",
    "EUSK",
    "EURO",
    "CCRA",
    "eurwar1",
    "marwar3",
    "grrwar1",
    "cogwar1",
    "savwar1",
    "webwar1",
    "garwar1",
    "grewhi1",
    "barwar1",
    "darwar1",
    "comnig1",
    "thrnig1",
    "cetwar1",
    "eupfly1",
    "colfly1",
    "eurtre1",
    "shttre1",
    "goldcr1",
    "firecr1",
    "woolar1",
    "dunnoc1",
    "winwre4",
    "ESPA",
    "EGOS",
    "BLAK",
    "redkit1",
    "combuz1",
    "euhbuz1",
    "EUKE",
    "EUHO",
    "PEFA",
    "EUBB",
    "SOTH",
    "MITH",
    "FIEL",
    "REDW",
    "eugori2",
    "EUJA",
    "ROOK",
    "carcro1",
    "CORA",
    "eurmag1",
    "eurjay1",
    "eugwoo2",
    "blawoo1",
    "GSWO",
    "miswoo1",
    "leswoo1"
  ],
  "vocalization_weights": {
    "song": 0.5,
    "call": 0.5
  },
  "overlap_multiplier": 1.0,
  "tempo_multiplier": 1.0
}
