{
  "pack_id": "nz_wetland_coastal",
  "region": "nz",
  "display_name": "Wetland & Coastal",
  "description": "Birds of New Zealand's waterways, wetlands, and coastlines. From the rare Blue Duck to the Yellow-eyed Penguin.",
  "species": [
    "bluduc1",
    "blasti1",
    "ausbit1",
    "grcgre1",
    "greegr",
    "rebdot1",
    "yeepen1",
    "wespet1",
    "hutshe1",
    "auitea1"
  ],
  "vocalization_weights": {
    "song": 0.4,
    "call": 0.6
  },
  "overlap_multiplier": 1.0,
  "tempo_multiplier": 1.0
}
