{
  "pack_id": "nz_all_birds",
  "region": "nz",
  "display_name": "All NZ Birds",
  "description": "The complete collection of 37 New Zealand native bird species. Audio courtesy of the NZ Department of Conservation (Crown Copyright).",
  "species": [
    "auitea1",
    "ausbit1",
    "blasti1",
    "bluduc1",
    "chaoys1",
    "grcgre1",
    "greegr",
    "gryger1",
    "hutshe1",
    "kakapo2",
    "kea1",
    "kokako3",
    "malpar2",
    "morepo2",
    "nezbel1",
    "nezfal1",
    "nezfan1",
    "nezkak1",
    "nezpig2",
    "nezpig3",
    "nezrob2",
    "nezrob3",
    "nibkiw1",
    "parshe1",
    "rebdot1",
    "refpar4",
    "saddle2",
    "saddle3",
    "silver3",
    "soiwre1",
    "stitch1",
    "takahe3",
    "tomtit1",
    "tui1",
    "weka1",
    "wespet1",
    "whiteh1",
    "yeepen1",
    "yellow3"
  ],
  "display_species": [
    "auitea1",
    "ausbit1",
    "blasti1",
    "bluduc1",
    "chaoys1",
    "grcgre1",
    "greegr",
    "gryger1",
    "hutshe1",
    "kakapo2",
    "kea1",
    "kokako3",
    "malpar2",
    "morepo2",
    "nezbel1",
    "nezfal1",
    "nezfan1",
    "nezkak1",
    "nezpig2",
    "nezpig3",
    "nezrob2",
    "nibkiw1",
    "parshe1",
    "rebdot1",
    "refpar4",
    "saddle2",
    "silver3",
    "soiwre1",
    "stitch1",
    "takahe3",
    "tomtit1",
    "tui1",
    "weka1",
    "wespet1",
    "whiteh1",
    "yeepen1",
    "yellow3"
  ],
  "vocalization_weights": {
    "song": 0.5,
    "call": 0.5
  },
  "overlap_multiplier": 1.0,
  "tempo_multiplier": 1.0
}
